{
  "schemaVersion": 1,
  "balanceVersion": "user-approved-2026-09-12-r3",
  "minClassLevel": 1,
  "maxClassLevel": 40,
  "attributePointsPerLevel": 15,
  "totalPotentialAttributePoints": 585,
  "levels": [
    { "levelFrom": 1, "levelTo": 2, "xpRequired": 200, "totalAccumulated": 200, "pace": "Rápida" },
    { "levelFrom": 2, "levelTo": 3, "xpRequired": 320, "totalAccumulated": 520, "pace": "Rápida" },
    { "levelFrom": 3, "levelTo": 4, "xpRequired": 480, "totalAccumulated": 1000, "pace": "Rápida" },
    { "levelFrom": 4, "levelTo": 5, "xpRequired": 700, "totalAccumulated": 1700, "pace": "Rápida" },
    { "levelFrom": 5, "levelTo": 6, "xpRequired": 1000, "totalAccumulated": 2700, "pace": "Média" },
    { "levelFrom": 6, "levelTo": 7, "xpRequired": 1400, "totalAccumulated": 4100, "pace": "Média" },
    { "levelFrom": 7, "levelTo": 8, "xpRequired": 1900, "totalAccumulated": 6000, "pace": "Média" },
    { "levelFrom": 8, "levelTo": 9, "xpRequired": 2500, "totalAccumulated": 8500, "pace": "Média" },
    { "levelFrom": 9, "levelTo": 10, "xpRequired": 3200, "totalAccumulated": 11700, "pace": "Média" },
    { "levelFrom": 10, "levelTo": 11, "xpRequired": 4100, "totalAccumulated": 15800, "pace": "Lenta" },
    { "levelFrom": 11, "levelTo": 12, "xpRequired": 5100, "totalAccumulated": 20900, "pace": "Lenta" },
    { "levelFrom": 12, "levelTo": 13, "xpRequired": 6300, "totalAccumulated": 27200, "pace": "Lenta" },
    { "levelFrom": 13, "levelTo": 14, "xpRequired": 7600, "totalAccumulated": 34800, "pace": "Lenta" },
    { "levelFrom": 14, "levelTo": 15, "xpRequired": 9100, "totalAccumulated": 43900, "pace": "Lenta" },
    { "levelFrom": 15, "levelTo": 16, "xpRequired": 10800, "totalAccumulated": 54700, "pace": "Lenta" },
    { "levelFrom": 16, "levelTo": 17, "xpRequired": 12700, "totalAccumulated": 67400, "pace": "Lenta" },
    { "levelFrom": 17, "levelTo": 18, "xpRequired": 14800, "totalAccumulated": 82200, "pace": "Lenta" },
    { "levelFrom": 18, "levelTo": 19, "xpRequired": 17200, "totalAccumulated": 99400, "pace": "Lenta" },
    { "levelFrom": 19, "levelTo": 20, "xpRequired": 19800, "totalAccumulated": 119200, "pace": "Lenta" },
    { "levelFrom": 20, "levelTo": 21, "xpRequired": 23000, "totalAccumulated": 142200, "pace": "Muito Lenta" },
    { "levelFrom": 21, "levelTo": 22, "xpRequired": 26500, "totalAccumulated": 168700, "pace": "Muito Lenta" },
    { "levelFrom": 22, "levelTo": 23, "xpRequired": 30500, "totalAccumulated": 199200, "pace": "Muito Lenta" },
    { "levelFrom": 23, "levelTo": 24, "xpRequired": 34800, "totalAccumulated": 234000, "pace": "Muito Lenta" },
    { "levelFrom": 24, "levelTo": 25, "xpRequired": 39500, "totalAccumulated": 273500, "pace": "Muito Lenta" },
    { "levelFrom": 25, "levelTo": 26, "xpRequired": 44500, "totalAccumulated": 318000, "pace": "Muito Lenta" },
    { "levelFrom": 26, "levelTo": 27, "xpRequired": 50000, "totalAccumulated": 368000, "pace": "Muito Lenta" },
    { "levelFrom": 27, "levelTo": 28, "xpRequired": 56000, "totalAccumulated": 424000, "pace": "Muito Lenta" },
    { "levelFrom": 28, "levelTo": 29, "xpRequired": 62500, "totalAccumulated": 486500, "pace": "Muito Lenta" },
    { "levelFrom": 29, "levelTo": 30, "xpRequired": 69500, "totalAccumulated": 556000, "pace": "Muito Lenta" },
    { "levelFrom": 30, "levelTo": 31, "xpRequired": 77000, "totalAccumulated": 633000, "pace": "Extremamente Lenta" },
    { "levelFrom": 31, "levelTo": 32, "xpRequired": 85500, "totalAccumulated": 718500, "pace": "Extremamente Lenta" },
    { "levelFrom": 32, "levelTo": 33, "xpRequired": 95000, "totalAccumulated": 813500, "pace": "Extremamente Lenta" },
    { "levelFrom": 33, "levelTo": 34, "xpRequired": 105500, "totalAccumulated": 919000, "pace": "Extremamente Lenta" },
    { "levelFrom": 34, "levelTo": 35, "xpRequired": 117000, "totalAccumulated": 1036000, "pace": "Extremamente Lenta" },
    { "levelFrom": 35, "levelTo": 36, "xpRequired": 130000, "totalAccumulated": 1166000, "pace": "Extremamente Lenta" },
    { "levelFrom": 36, "levelTo": 37, "xpRequired": 144500, "totalAccumulated": 1310500, "pace": "Extremamente Lenta" },
    { "levelFrom": 37, "levelTo": 38, "xpRequired": 160500, "totalAccumulated": 1471000, "pace": "Extremamente Lenta" },
    { "levelFrom": 38, "levelTo": 39, "xpRequired": 178500, "totalAccumulated": 1649500, "pace": "Extremamente Lenta" },
    { "levelFrom": 39, "levelTo": 40, "xpRequired": 198500, "totalAccumulated": 1848000, "pace": "Extremamente Lenta" }
  ]
}
